"DESCRIPTION","DURATION IN MS","NAME","PARENT SUITE","START TIME","STATUS","STOP TIME","SUB SUITE","SUITE","TEST CLASS","TEST METHOD"
"Runs the full loan journey from start to finish with a fresh mobile number, validating all major checkpoints.","122540","Sanity: Complete Loan Journey in one go","Single Test Suite","Wed Jul 23 13:24:12 IST 2025","broken","Wed Jul 23 13:26:14 IST 2025","SanityTest.LoanJourneySanityTest","Single Test","SanityTest.LoanJourneySanityTest","testFullLoanJourneySanity"
"","28004","Test Aadhaar KYC bypass with custom data","Default Suite","Wed Jul 16 17:37:41 IST 2025","passed","Wed Jul 16 17:38:09 IST 2025","testClassPool.CompleteYourAadharKYCTest","stashfin-website","testClassPool.CompleteYourAadharKYCTest","TC34_testAadhaarKYCBypassWithCustomData"
"","28868","Test complete Aadhaar KYC page flow","Default Suite","Wed Jul 16 16:27:26 IST 2025","passed","Wed Jul 16 16:27:55 IST 2025","testClassPool.CompleteYourAadharKYCTest","stashfin-website","testClassPool.CompleteYourAadharKYCTest","TC28_testCompleteAadhaarKYCPageFlow"
"Runs the full loan journey from start to finish with a fresh mobile number, validating all major checkpoints.","119775","Sanity: Complete Loan Journey in one go","Default Suite","Fri Jul 18 11:57:16 IST 2025","broken","Fri Jul 18 11:59:15 IST 2025","rough.LoanJourneyFlowForNonSTP","stashfin-website","rough.LoanJourneyFlowForNonSTP","testFullLoanJourneySanity"
"","25346","Test Aadhaar KYC bypass functionality","Default Suite","Wed Jul 16 17:07:58 IST 2025","passed","Wed Jul 16 17:08:24 IST 2025","testClassPool.CompleteYourAadharKYCTest","stashfin-website","testClassPool.CompleteYourAadharKYCTest","TC33_testAadhaarKYCBypass"
"","29216","Test continue button functionality","Default Suite","Wed Jul 16 16:19:14 IST 2025","passed","Wed Jul 16 16:19:43 IST 2025","testClassPool.CompleteYourAadharKYCTest","stashfin-website","testClassPool.CompleteYourAadharKYCTest","TC22_testContinueButtonFunctionality"
