"DESCRIPTION","DURATION IN MS","NAME","PARENT SUITE","START TIME","STATUS","STOP TIME","SUB SUITE","SUITE","TEST CLASS","TEST METHOD"
"Runs the full loan journey from start to finish with a fresh mobile number, validating all major checkpoints.","76379","Sanity: Complete Loan Journey in one go","Single Test Suite","Thu Jul 17 10:12:18 IST 2025","broken","Thu Jul 17 10:13:35 IST 2025","SanityTest.LoanJourneySanityTest","Single Test","SanityTest.LoanJourneySanityTest","testFullLoanJourneySanity"
"","29216","Test continue button functionality","Default Suite","Wed Jul 16 16:19:14 IST 2025","passed","Wed Jul 16 16:19:43 IST 2025","testClassPool.CompleteYourAadharKYCTest","stashfin-website","testClassPool.CompleteYourAadharKYCTest","TC22_testContinueButtonFunctionality"
"","28868","Test complete Aadhaar KYC page flow","Default Suite","Wed Jul 16 16:27:26 IST 2025","passed","Wed Jul 16 16:27:55 IST 2025","testClassPool.CompleteYourAadharKYCTest","stashfin-website","testClassPool.CompleteYourAadharKYCTest","TC28_testCompleteAadhaarKYCPageFlow"
"Runs the full loan journey from start to finish with a fresh mobile number, validating all major checkpoints.","59781","Sanity: Complete Loan Journey in one go","Default Suite","Thu Jul 17 09:24:52 IST 2025","broken","Thu Jul 17 09:25:52 IST 2025","rough.LoanJourneyFlowForNonSTP","stashfin-website","rough.LoanJourneyFlowForNonSTP","testFullLoanJourneySanity"
"","28004","Test Aadhaar KYC bypass with custom data","Default Suite","Wed Jul 16 17:37:41 IST 2025","passed","Wed Jul 16 17:38:09 IST 2025","testClassPool.CompleteYourAadharKYCTest","stashfin-website","testClassPool.CompleteYourAadharKYCTest","TC34_testAadhaarKYCBypassWithCustomData"
"","25346","Test Aadhaar KYC bypass functionality","Default Suite","Wed Jul 16 17:07:58 IST 2025","passed","Wed Jul 16 17:08:24 IST 2025","testClassPool.CompleteYourAadharKYCTest","stashfin-website","testClassPool.CompleteYourAadharKYCTest","TC33_testAadhaarKYCBypass"
